{
  "$schema": "https://json-schema.org/draft/2020-12/schema",
  "type": "object",
  "properties": {
    "record_id": {
      "type": "string",
      "minLength": 1
    },
    "site_id": {
      "type": "string",
      "minLength": 1
    },
    "source_message_id": {
      "type": "string",
      "minLength": 1
    },
    "sent_at": {
      "type": "string",
      "format": "date-time",
      "pattern": "^(?:(?:\\d\\d[2468][048]|\\d\\d[13579][26]|\\d\\d0[48]|[02468][048]00|[13579][26]00)-02-29|\\d{4}-(?:(?:0[13578]|1[02])-(?:0[1-9]|[12]\\d|3[01])|(?:0[469]|11)-(?:0[1-9]|[12]\\d|30)|(?:02)-(?:0[1-9]|1\\d|2[0-8])))T(?:(?:[01]\\d|2[0-3]):[0-5]\\d:[0-5]\\d(?:\\.\\d+)?(?:Z|([+-](?:[01]\\d|2[0-3]):[0-5]\\d)))$"
    },
    "sender_raw": {
      "type": "string",
      "minLength": 1
    },
    "sender_person_id": {
      "anyOf": [
        {
          "type": "string",
          "minLength": 1
        },
        {
          "type": "null"
        }
      ]
    },
    "confidence": {
      "type": "number",
      "minimum": 0,
      "maximum": 1
    },
    "person_id": {
      "type": "string",
      "minLength": 1
    },
    "canonical_name": {
      "type": "string",
      "minLength": 1
    },
    "aliases": {
      "type": "array",
      "items": {
        "type": "string",
        "minLength": 1
      }
    },
    "role": {
      "type": "string",
      "enum": [
        "operational_manager",
        "project_coordinator",
        "pimpro",
        "team_leader",
        "cleaner",
        "admin",
        "client_pic"
      ]
    },
    "area_default": {
      "anyOf": [
        {
          "type": "string",
          "minLength": 1
        },
        {
          "type": "null"
        }
      ]
    },
    "active_from": {
      "type": "string",
      "format": "date",
      "pattern": "^(?:(?:\\d\\d[2468][048]|\\d\\d[13579][26]|\\d\\d0[48]|[02468][048]00|[13579][26]00)-02-29|\\d{4}-(?:(?:0[13578]|1[02])-(?:0[1-9]|[12]\\d|3[01])|(?:0[469]|11)-(?:0[1-9]|[12]\\d|30)|(?:02)-(?:0[1-9]|1\\d|2[0-8])))$"
    },
    "active_to": {
      "anyOf": [
        {
          "type": "string",
          "format": "date",
          "pattern": "^(?:(?:\\d\\d[2468][048]|\\d\\d[13579][26]|\\d\\d0[48]|[02468][048]00|[13579][26]00)-02-29|\\d{4}-(?:(?:0[13578]|1[02])-(?:0[1-9]|[12]\\d|3[01])|(?:0[469]|11)-(?:0[1-9]|[12]\\d|30)|(?:02)-(?:0[1-9]|1\\d|2[0-8])))$"
        },
        {
          "type": "null"
        }
      ]
    }
  },
  "required": [
    "record_id",
    "site_id",
    "source_message_id",
    "sent_at",
    "sender_raw",
    "sender_person_id",
    "confidence",
    "person_id",
    "canonical_name",
    "aliases",
    "role",
    "area_default",
    "active_from",
    "active_to"
  ],
  "additionalProperties": false
}
