[
 {
  "record_id": "per_0",
  "site_id": "lwas",
  "source_message_id": "msg_0_420",
  "sent_at": "2026-09-10T07:00:00+07:00",
  "sender_raw": "Amartha",
  "sender_person_id": null,
  "confidence": 0.9,
  "person_id": "p_0",
  "canonical_name": "Amartha",
  "aliases": [],
  "role": "team_leader",
  "area_default": "area_0",
  "active_from": "2026-01-01",
  "active_to": null
 },
 {
  "record_id": "per_1",
  "site_id": "lwas",
  "source_message_id": "msg_0_420",
  "sent_at": "2026-09-10T07:00:00+07:00",
  "sender_raw": "Faisal Hanafi",
  "sender_person_id": null,
  "confidence": 0.9,
  "person_id": "p_1",
  "canonical_name": "Faisal Hanafi",
  "aliases": [],
  "role": "pimpro",
  "area_default": "area_1",
  "active_from": "2026-01-01",
  "active_to": null
 },
 {
  "record_id": "per_2",
  "site_id": "lwas",
  "source_message_id": "msg_0_420",
  "sent_at": "2026-09-10T07:00:00+07:00",
  "sender_raw": "Aldo",
  "sender_person_id": null,
  "confidence": 0.9,
  "person_id": "p_2",
  "canonical_name": "Aldo",
  "aliases": [],
  "role": "team_leader",
  "area_default": "area_2",
  "active_from": "2026-01-01",
  "active_to": null
 },
 {
  "record_id": "per_3",
  "site_id": "lwas",
  "source_message_id": "msg_0_420",
  "sent_at": "2026-09-10T07:00:00+07:00",
  "sender_raw": "Acenk (Bontot)",
  "sender_person_id": null,
  "confidence": 0.9,
  "person_id": "p_3",
  "canonical_name": "Acenk (Bontot)",
  "aliases": [],
  "role": "team_leader",
  "area_default": "area_3",
  "active_from": "2026-01-01",
  "active_to": null
 },
 {
  "record_id": "per_4",
  "site_id": "lwas",
  "source_message_id": "msg_0_420",
  "sent_at": "2026-09-10T07:00:00+07:00",
  "sender_raw": "N",
  "sender_person_id": null,
  "confidence": 0.9,
  "person_id": "p_4",
  "canonical_name": "N",
  "aliases": [],
  "role": "team_leader",
  "area_default": "area_4",
  "active_from": "2026-01-01",
  "active_to": null
 },
 {
  "record_id": "per_5",
  "site_id": "lwas",
  "source_message_id": "msg_0_420",
  "sent_at": "2026-09-10T07:00:00+07:00",
  "sender_raw": "yeyenriani",
  "sender_person_id": null,
  "confidence": 0.9,
  "person_id": "p_5",
  "canonical_name": "yeyenriani",
  "aliases": [],
  "role": "team_leader",
  "area_default": "area_5",
  "active_from": "2026-01-01",
  "active_to": null
 },
 {
  "record_id": "per_6",
  "site_id": "lwas",
  "source_message_id": "msg_0_420",
  "sent_at": "2026-09-10T07:00:00+07:00",
  "sender_raw": "Sarwedi",
  "sender_person_id": null,
  "confidence": 0.9,
  "person_id": "p_6",
  "canonical_name": "Sarwedi",
  "aliases": [],
  "role": "team_leader",
  "area_default": "area_6",
  "active_from": "2026-01-01",
  "active_to": null
 }
]
